begin,end,leftContext,surface,rightContext,entityNum,entityLabel,entityGroup
2,2463,,"Ingenieur - Projektleitung (m/w) Funktionale Sicherheit

  über Baumann Unternehmensberatung AG, Berlin, Wolfsburg oder Ingolstadt

  Ingenieur - Projektleitung (m/w) Funktionale Sicherheit Standort: Berlin, Wolfsburg oder Ingolstadt Ihr Profil Sie haben ein Studium der Elektrotechnik oder einen ver­wand­ten Studiengang erfolgreich abgeschlossen. Darüber hinaus verfügen Sie über fundierte und in der Praxis erprobte Fach­kennt­nisse aus den Bereichen Fahrzeugelektronik oder -ent­wick­lung. Praktische Erfahrungen in der Funk­tions­ent­wick­lung runden Ihr Qualifikationsprofil ab. Darüber hinaus können Sie souverän und kompetent mit Kunden kommunizieren und diese für neue Themen und Lösungen begeistern. Unser Klient Als eigenständige GmbH in einem der größten Auto­mobil­konzerne steht bei unserem Klienten die Software für die Fahrzeugelektronik im Mittelpunkt. Als kompetenter Berater, erfahrener Projektmanager und innovativer Entwickler erschließen die Mitarbeiter-/innen aktuelle Trends und begleiten die Kunden durch alle Umsetzungsphasen für neue Lösungen. Unser Klient Als eigenständige GmbH in einem der größten
  Auto­mobil­kon­zerne steht bei unserem Klienten die Software für die Fahr­zeug­elek­tro­nik im Mittelpunkt. Als kompetenter Berater, er­fah­re­ner Projektmanager und innovativer Entwickler er­schließen die Mitarbeiter-/innen aktuelle Trends und begleiten die Kunden durch alle Umsetzungsphasen für neue Lösungen. Ihre Aufgaben umfassende Betreuung und Beratung der OEMs im Bereich der /Funktionalen Sicherheit/ Vorbereitung und Organisation von Workshops im Bereich der Fahrzeugelektronik Technische Bewertung und Einstufung von sicherheitsrelevanten Fahrzeugfunktionen in Sicherheits- Integritätslevel Erarbeiten von Sicherheitskonzepten und Durchführung von Gefahren-Risikoanalysen Es erwartet Sie eine technisch vielseitige, spannende Aufgabe in einem dynamischen Umfeld mit einer offenen Führungskultur und flachen Hierarchien. Kontakt Für eine erste telefonische Kontaktaufnahme steht Ihnen unser Berater Guido Rehme unter +49 (69) 90 43 30 zur Verfügung, Referenz 160280J. Gerne können Sie uns auch
  einen Rückrufwunsch hinterlassen. Bitte senden Sie Ihre Unterlagen an bu@baumann-ag.com. Baumann Unternehmensberatung Executive Search Hanauer Landstraße 220 D-60314 Frankfurt am Main www.baumann-ag.com bu@baumann-ag.com Rufen Sie uns einfach heute an! Auch Samstag/Sonntag von 17:00 - 19:00 Uhr Tel. +49 (69) 90 43 30",,0,Stellenanzeige,false
2,134,,"Ingenieur - Projektleitung (m/w) Funktionale Sicherheit

  über Baumann Unternehmensberatung AG, Berlin, Wolfsburg oder Ingolstadt",Ingenieur - Projektleitung (m/,1,Irrelevantes (nicht aus 1-5),false
140,239,"lin, Wolfsburg oder Ingolstadt","Ingenieur - Projektleitung (m/w) Funktionale Sicherheit Standort: Berlin, Wolfsburg oder Ingolstadt",Ihr Profil Sie haben ein Studi,2,Irrelevantes (nicht aus 1-5),false
240,715,"lin, Wolfsburg oder Ingolstadt",Ihr Profil Sie haben ein Studium der Elektrotechnik oder einen ver­wand­ten Studiengang erfolgreich abgeschlossen. Darüber hinaus verfügen Sie über fundierte und in der Praxis erprobte Fach­kennt­nisse aus den Bereichen Fahrzeugelektronik oder -ent­wick­lung. Praktische Erfahrungen in der Funk­tions­ent­wick­lung runden Ihr Qualifikationsprofil ab. Darüber hinaus können Sie souverän und kompetent mit Kunden kommunizieren und diese für neue Themen und Lösungen begeistern.,Unser Klient Als eigenständige,3,Anforderungen,false
716,1820,hemen und Lösungen begeistern.,"Unser Klient Als eigenständige GmbH in einem der größten Auto­mobil­konzerne steht bei unserem Klienten die Software für die Fahrzeugelektronik im Mittelpunkt. Als kompetenter Berater, erfahrener Projektmanager und innovativer Entwickler erschließen die Mitarbeiter-/innen aktuelle Trends und begleiten die Kunden durch alle Umsetzungsphasen für neue Lösungen. Unser Klient Als eigenständige GmbH in einem der größten
  Auto­mobil­kon­zerne steht bei unserem Klienten die Software für die Fahr­zeug­elek­tro­nik im Mittelpunkt. Als kompetenter Berater, er­fah­re­ner Projektmanager und innovativer Entwickler er­schließen die Mitarbeiter-/innen aktuelle Trends und begleiten die Kunden durch alle Umsetzungsphasen für neue Lösungen. Ihre Aufgaben umfassende Betreuung und Beratung der OEMs im Bereich der /Funktionalen Sicherheit/ Vorbereitung und Organisation von Workshops im Bereich der Fahrzeugelektronik Technische Bewertung und Einstufung von sicherheitsrelevanten Fahrzeugfunktionen in Sicherheits- Integritätslevel Erarbeiten von Sicherheitskonzepten und Durchführung von Gefahren-Risikoanalysen",Es erwartet Sie eine technisch,4,Kombination aus 1 und 2,false
1821,1968,ng von Gefahren-Risikoanalysen,"Es erwartet Sie eine technisch vielseitige, spannende Aufgabe in einem dynamischen Umfeld mit einer offenen Führungskultur und flachen Hierarchien.",Kontakt Für eine erste telefon,5,Angebot an den Bewerber,false
1969,2365,ultur und flachen Hierarchien.,"Kontakt Für eine erste telefonische Kontaktaufnahme steht Ihnen unser Berater Guido Rehme unter +49 (69) 90 43 30 zur Verfügung, Referenz 160280J. Gerne können Sie uns auch
  einen Rückrufwunsch hinterlassen. Bitte senden Sie Ihre Unterlagen an bu@baumann-ag.com. Baumann Unternehmensberatung Executive Search Hanauer Landstraße 220 D-60314 Frankfurt am Main www.baumann-ag.com bu@baumann-ag.com",Rufen Sie uns einfach heute an,6,Kontakt und Formalia,false
